{
  "spec_id": "FEAT-BORDA",
  "dispatch_id": "d-T-001-dev-l1",
  "role": "dev",
  "status": "done",
  "summary": "Loop 1 dev.",
  "evidence": [
    { "id": "e-001", "kind": "command", "ref": "npx vitest run src/x.test.ts", "exit": 0, "detail": "3 tests OK" }
  ],
  "files_changed": ["src/x.ts"],
  "findings": [],
  "usage": null
}
